{
  "$schema": "http://json-schema.org/draft-07/schema#",
  "$id": "https://github.com/ghreprimand/odytty/compat/vttest/schema/result.schema.json",
  "title": "OdyTTY conformance result document",
  "description": "Public result contract for a pinned conformance run. The central design rule is that runner health and compatibility outcome are separate fields that are never collapsed: a run that failed to execute must never be readable as a compatibility pass, and a compatibility failure must never be readable as a broken runner.",
  "type": "object",
  "required": [
    "schema_version",
    "generated_utc",
    "runner",
    "upstream",
    "subject",
    "environment",
    "cases",
    "totals",
    "limitations"
  ],
  "additionalProperties": false,
  "properties": {
    "schema_version": {
      "description": "Version of this result contract. Incremented when a consumer would have to change to read the document.",
      "type": "string",
      "pattern": "^[0-9]+\\.[0-9]+\\.[0-9]+$"
    },
    "generated_utc": {
      "description": "Document creation time, UTC, seconds precision.",
      "type": "string",
      "pattern": "^[0-9]{4}-[0-9]{2}-[0-9]{2}T[0-9]{2}:[0-9]{2}:[0-9]{2}Z$"
    },
    "runner": {
      "description": "Health of the harness itself. Says nothing about compatibility.",
      "type": "object",
      "required": ["status", "phase", "runner_version", "python_version", "platform_class", "message"],
      "additionalProperties": false,
      "properties": {
        "status": {
          "description": "ok: the harness completed its work. error: the harness failed; no compatibility conclusion may be drawn. unsupported_platform: the harness cannot run here at all.",
          "type": "string",
          "enum": ["ok", "error", "unsupported_platform"]
        },
        "phase": {
          "description": "Phase reached. On error, the phase that failed.",
          "type": "string",
          "enum": ["fetch", "verify", "extract", "build", "run", "sanitize", "validate", "complete"]
        },
        "runner_version": { "type": "string", "pattern": "^[0-9]+\\.[0-9]+\\.[0-9]+$" },
        "python_version": { "type": "string", "minLength": 1 },
        "platform_class": {
          "description": "Coarse platform label. Deliberately coarse: a precise host description is machine-identifying.",
          "type": "string",
          "minLength": 1
        },
        "message": {
          "description": "Sanitized explanation. Empty when status is ok.",
          "type": "string"
        }
      }
    },
    "upstream": {
      "description": "Which suite was used, and what was actually proven about it.",
      "type": "object",
      "required": ["project", "release", "archive_sha256", "signer_fingerprint", "snapshot_commit", "verification", "build"],
      "additionalProperties": false,
      "properties": {
        "project": { "type": "string", "minLength": 1 },
        "release": { "type": "string", "minLength": 1 },
        "archive_sha256": { "type": "string", "pattern": "^[0-9a-f]{64}$" },
        "signer_fingerprint": { "type": "string", "pattern": "^[0-9A-F]{40}$" },
        "snapshot_commit": { "type": "string", "pattern": "^[0-9a-f]{40}$" },
        "verification": {
          "description": "What was checked, as opposed to what was declared.",
          "type": "object",
          "required": ["sha256", "signature", "trust_root"],
          "additionalProperties": false,
          "properties": {
            "sha256": { "type": "string", "enum": ["verified", "mismatch", "not_checked"] },
            "signature": { "type": "string", "enum": ["verified", "mismatch", "tool_unavailable", "not_checked"] },
            "trust_root": {
              "description": "isolated_pinned: the signature was checked against a throwaway keyring built from the pinned fingerprint alone. not_checked: no trust root was built. mismatch: the retrieved key did not carry the pinned fingerprint. A signature verified against whatever keys the running machine already trusts is not reproducible and is never recorded as isolated_pinned.",
              "type": "string",
              "enum": ["isolated_pinned", "mismatch", "not_checked"]
            }
          }
        },
        "build": {
          "description": "How the pinned suite was turned into the binary that ran. A conformance result whose suite build cannot be identified is not reproducible.",
          "type": "object",
          "required": ["status", "binary_sha256", "toolchain"],
          "additionalProperties": false,
          "properties": {
            "status": { "type": "string", "enum": ["built", "not_built"] },
            "binary_sha256": { "type": "string", "pattern": "^([0-9a-f]{64}|unknown)$" },
            "toolchain": {
              "description": "One entry per build tool, first version line only. Deliberately coarse: the remainder is host detail that can name a machine.",
              "type": "array",
              "items": { "type": "string", "minLength": 1 }
            }
          }
        }
      }
    },
    "subject": {
      "description": "The build under test. A result without an exact revision is not evidence.",
      "type": "object",
      "required": ["product", "version", "revision", "build_profile", "invocation"],
      "additionalProperties": false,
      "properties": {
        "product": { "type": "string", "minLength": 1 },
        "version": { "type": "string", "minLength": 1 },
        "revision": {
          "description": "Exact commit SHA, or the literal string unknown. Never a branch name.",
          "type": "string",
          "pattern": "^([0-9a-f]{40}|unknown)$"
        },
        "build_profile": { "type": "string", "enum": ["release", "debug"] },
        "invocation": {
          "description": "Argument vector shape as executed, with machine-specific paths replaced by named placeholders. Never a shell string: this harness never invokes a shell.",
          "type": "array",
          "items": { "type": "string" },
          "minItems": 1
        }
      }
    },
    "environment": {
      "type": "object",
      "required": ["class", "term", "locale", "geometry", "isolated_state"],
      "additionalProperties": false,
      "properties": {
        "class": { "type": "string", "minLength": 1 },
        "term": { "type": "string", "minLength": 1 },
        "locale": { "type": "string", "minLength": 1 },
        "geometry": {
          "type": "object",
          "required": ["rows", "columns", "verified"],
          "additionalProperties": false,
          "properties": {
            "rows": { "type": "integer", "minimum": 1 },
            "columns": { "type": "integer", "minimum": 1 },
            "verified": {
              "description": "False when the geometry was declared but could not be confirmed as applied. A false value must be accompanied by a limitation entry.",
              "type": "boolean"
            }
          }
        },
        "isolated_state": {
          "description": "True when the run used a private configuration and state directory rather than the invoking user's.",
          "type": "boolean"
        }
      }
    },
    "cases": {
      "description": "One entry per case considered. Cases that were not run appear with skip, ignore, or unsupported, never omitted: a silently absent case is indistinguishable from a case that was never written.",
      "type": "array",
      "items": {
        "type": "object",
        "required": ["id", "title", "classification", "outcome", "reason", "duration_ms", "evidence", "deviations"],
        "additionalProperties": false,
        "properties": {
          "id": { "type": "string", "minLength": 1 },
          "title": { "type": "string", "minLength": 1 },
          "classification": {
            "type": "string",
            "enum": [
              "automated_replay",
              "upstream_log_oracle",
              "interactive_keyboard",
              "visual_manual",
              "platform_dependent",
              "unsupported",
              "unsafe_unattended"
            ]
          },
          "outcome": {
            "description": "pass: observed correct. fail: observed incorrect. skip: not attempted this run. ignore: attempted, result deliberately not counted. unsupported: cannot apply here. There is no partial and no unknown; an unclear result is a fail or a skip with a reason.",
            "type": "string",
            "enum": ["pass", "fail", "skip", "ignore", "unsupported"]
          },
          "reason": {
            "description": "Required for every outcome other than pass. An unexplained skip is a hidden gap.",
            "type": "string"
          },
          "duration_ms": { "type": "integer", "minimum": 0 },
          "evidence": {
            "type": "object",
            "required": ["kind", "sanitized", "reference"],
            "additionalProperties": false,
            "properties": {
              "kind": { "type": "string", "enum": ["capture_file", "exit_status", "manual_observation", "none"] },
              "sanitized": { "type": "boolean" },
              "reference": { "type": "string" }
            }
          },
          "deviations": {
            "description": "Documented, intentional differences from the reference behavior. Present and empty rather than absent when there are none, so an empty list is a statement rather than an omission.",
            "type": "array",
            "items": {
              "type": "object",
              "required": ["summary", "rationale"],
              "additionalProperties": false,
              "properties": {
                "summary": { "type": "string", "minLength": 1 },
                "rationale": { "type": "string", "minLength": 1 }
              }
            }
          }
        }
      }
    },
    "totals": {
      "description": "Counts per outcome. Must sum to the number of case entries; a total that disagrees with the case list is a corrupt document.",
      "type": "object",
      "required": ["pass", "fail", "skip", "ignore", "unsupported"],
      "additionalProperties": false,
      "properties": {
        "pass": { "type": "integer", "minimum": 0 },
        "fail": { "type": "integer", "minimum": 0 },
        "skip": { "type": "integer", "minimum": 0 },
        "ignore": { "type": "integer", "minimum": 0 },
        "unsupported": { "type": "integer", "minimum": 0 }
      }
    },
    "limitations": {
      "description": "Everything that weakens this result. Required and may be empty only when nothing weakens it, which is rare enough to be worth justifying.",
      "type": "array",
      "items": { "type": "string", "minLength": 1 }
    }
  }
}
